SELECT citus.mitmproxy('flow.allow()');
 mitmproxy 
-----------
 
(1 row)

SET citus.shard_count = 1;
SET citus.shard_replication_factor = 2; -- one shard per worker
SET citus.multi_shard_commit_protocol TO '1pc';
SET citus.next_shard_id TO 100400;
ALTER SEQUENCE pg_catalog.pg_dist_placement_placementid_seq RESTART 100;
CREATE TABLE copy_test (key int, value int);
SELECT create_distributed_table('copy_test', 'key');
 create_distributed_table 
--------------------------
 
(1 row)

SELECT citus.clear_network_traffic();
 clear_network_traffic 
-----------------------
 
(1 row)

COPY copy_test FROM PROGRAM 'echo 0, 0 && echo 1, 1 && echo 2, 4 && echo 3, 9' WITH CSV;
SELECT count(1) FROM copy_test;
 count 
-------
     4
(1 row)

SELECT * FROM citus.dump_network_traffic(dump_unknown_messages => true);
 conn | from_client |                                                                                                                                                                                                                                                                                               message                                                                                                                                                                                                                                                                                               
------+-------------+-----------------------------------------------------------------------------------------------------------------------------------------------------------------------------------------------------------------------------------------------------------------------------------------------------------------------------------------------------------------------------------------------------------------------------------------------------------------------------------------------------------------------------------------------------------------------------------------------------
    0 | t           | [initial message]
    0 | f           | ['AuthenticationOk()', 'ParameterStatus(application_name=citus)', 'ParameterStatus(client_encoding=UTF8)', 'ParameterStatus(DateStyle=ISO, MDY)', 'ParameterStatus(integer_datetimes=on)', 'ParameterStatus(IntervalStyle=postgres)', 'ParameterStatus(is_superuser=on)', 'ParameterStatus(server_encoding=UTF8)', 'ParameterStatus(server_version=10.3)', 'ParameterStatus(session_authorization=postgres)', 'ParameterStatus(standard_conforming_strings=on)', 'ParameterStatus(TimeZone=Turkey)', 'BackendKeyData(XXX)', 'ReadyForQuery(state=idle)']
    0 | t           | ["Query(query=BEGIN TRANSACTION ISOLATION LEVEL READ COMMITTED;SELECT assign_distributed_transaction_id(0, 4, 'XXXX-XX-XX XX:XX:XX.XXXXXX-XX');"]
    0 | f           | ['CommandComplete(command=BEGIN)', "RowDescription(fieldcount=1,fields=['F(name=assign_distributed_transaction_id,tableoid=0,colattrnum=0,typoid=2278,typlen=4,typmod=-1,format_code=0)'])", 'DataRow(columncount=1,columns=["C(length=0,value=b\'\')"])', 'CommandComplete(command=SELECT 1)', 'ReadyForQuery(state=in_transaction_block)']
    0 | t           | ['Query(query=COPY public.copy_test_XXXXXX (key, value) FROM STDIN WITH (FORMAT BINARY)']
    0 | f           | ["Backend(type=G,body=b'\\x01\\x00\\x02\\x00\\x01\\x00\\x01')"]
    0 | t           | ["CopyData(data=b'PGCOPY\\n\\xff\\r\\n\\x00\\x00\\x00\\x00\\x00\\x00\\x00\\x00\\x00')", "CopyData(data=b'\\x00\\x02\\x00\\x00\\x00\\x04\\x00\\x00\\x00\\x00\\x00\\x00\\x00\\x04\\x00\\x00\\x00\\x00')", "CopyData(data=b'\\x00\\x02\\x00\\x00\\x00\\x04\\x00\\x00\\x00\\x01\\x00\\x00\\x00\\x04\\x00\\x00\\x00\\x01')", "CopyData(data=b'\\x00\\x02\\x00\\x00\\x00\\x04\\x00\\x00\\x00\\x02\\x00\\x00\\x00\\x04\\x00\\x00\\x00\\x04')", "CopyData(data=b'\\x00\\x02\\x00\\x00\\x00\\x04\\x00\\x00\\x00\\x03\\x00\\x00\\x00\\x04\\x00\\x00\\x00\\t')", "CopyData(data=b'\\xff\\xff')", 'CopyDone()']
    0 | f           | ['CommandComplete(command=COPY 4)', 'ReadyForQuery(state=in_transaction_block)']
    0 | t           | ['Query(query=COMMIT']
    0 | f           | ['CommandComplete(command=COMMIT)', 'ReadyForQuery(state=idle)']
    0 | t           | ['Terminate()']
    1 | t           | [initial message]
    1 | f           | ['AuthenticationOk()', 'ParameterStatus(application_name=citus)', 'ParameterStatus(client_encoding=UTF8)', 'ParameterStatus(DateStyle=ISO, MDY)', 'ParameterStatus(integer_datetimes=on)', 'ParameterStatus(IntervalStyle=postgres)', 'ParameterStatus(is_superuser=on)', 'ParameterStatus(server_encoding=UTF8)', 'ParameterStatus(server_version=10.3)', 'ParameterStatus(session_authorization=postgres)', 'ParameterStatus(standard_conforming_strings=on)', 'ParameterStatus(TimeZone=Turkey)', 'BackendKeyData(XXX)', 'ReadyForQuery(state=idle)']
    1 | t           | ['Query(query=SELECT count(1) AS count FROM public.copy_test_XXXXXX copy_test']
    1 | f           | ["RowDescription(fieldcount=1,fields=['F(name=count,tableoid=0,colattrnum=0,typoid=20,typlen=8,typmod=-1,format_code=0)'])", 'DataRow(columncount=1,columns=["C(length=0,value=b\'\')"])', 'CommandComplete(command=SELECT 1)', 'ReadyForQuery(state=idle)']
(15 rows)

-- ==== kill the connection when we try to start a transaction ====
-- the query should abort
SELECT citus.mitmproxy('flow.contains(b"assign_distributed_transaction").killall()');
 mitmproxy 
-----------
 
(1 row)

COPY copy_test FROM PROGRAM 'echo 0, 0 && echo 1, 1 && echo 2, 4 && echo 3, 9' WITH CSV;
WARNING:  connection not open
CONTEXT:  while executing command on localhost:57640
COPY copy_test, line 1: "0, 0"
ERROR:  failure on connection marked as essential: localhost:57640
CONTEXT:  COPY copy_test, line 1: "0, 0"
SELECT * FROM citus.dump_network_traffic();
 conn | from_client |                                                                      message                                                                      
------+-------------+---------------------------------------------------------------------------------------------------------------------------------------------------
    1 | t           | ["Query(query=BEGIN TRANSACTION ISOLATION LEVEL READ COMMITTED;SELECT assign_distributed_transaction_id(0, 5, 'XXXX-XX-XX XX:XX:XX.XXXXXX-XX');"]
(1 row)

-- ==== kill the connection when we try to start the COPY ====
-- the query should abort
SELECT citus.mitmproxy('flow.contains(b"FROM STDIN WITH").killall()');
 mitmproxy 
-----------
 
(1 row)

COPY copy_test FROM PROGRAM 'echo 0, 0 && echo 1, 1 && echo 2, 4 && echo 3, 9' WITH CSV;
ERROR:  server closed the connection unexpectedly
	This probably means the server terminated abnormally
	before or while processing the request.
CONTEXT:  while executing command on localhost:57640
COPY copy_test, line 1: "0, 0"
-- ==== kill the connection when we first start sending data ====
-- the query should abort
SELECT citus.mitmproxy('flow.matches(b"^d").killall()'); -- raw rows from the client
 mitmproxy 
-----------
 
(1 row)

COPY copy_test FROM PROGRAM 'echo 0, 0 && echo 1, 1 && echo 2, 4 && echo 3, 9' WITH CSV;
ERROR:  failed to COPY to shard 100400 on localhost:57640
-- ==== kill the connection when we try to send COMMIT ====
-- the query should succeed, and the placement should be marked inactive
SELECT citus.mitmproxy('flow.allow()');
 mitmproxy 
-----------
 
(1 row)

SELECT count(1) FROM pg_dist_shard_placement WHERE shardid IN (
  SELECT shardid FROM pg_dist_shard WHERE logicalrelid = 'copy_test'::regclass
) AND shardstate = 3;
 count 
-------
     0
(1 row)

SELECT count(1) FROM copy_test;
 count 
-------
     4
(1 row)

SELECT citus.mitmproxy('flow.matches(b"COMMIT[^T]").killall()'); -- don't match "COMMITTED"
 mitmproxy 
-----------
 
(1 row)

COPY copy_test FROM PROGRAM 'echo 0, 0 && echo 1, 1 && echo 2, 4 && echo 3, 9' WITH CSV;
WARNING:  connection not open
CONTEXT:  while executing command on localhost:57640
WARNING:  failed to commit critical transaction on localhost:57640, metadata is likely out of sync
WARNING:  connection not open
CONTEXT:  while executing command on localhost:57640
-- the shard is marked invalid
SELECT citus.mitmproxy('flow.allow()');
 mitmproxy 
-----------
 
(1 row)

SELECT count(1) FROM pg_dist_shard_placement WHERE shardid IN (
  SELECT shardid FROM pg_dist_shard WHERE logicalrelid = 'copy_test'::regclass
) AND shardstate = 3;
 count 
-------
     1
(1 row)

SELECT count(1) FROM copy_test;
 count 
-------
     8
(1 row)

-- ==== clean up a little bit before running the next test ====
UPDATE pg_dist_shard_placement SET shardstate = 1
WHERE shardid IN (
  SELECT shardid FROM pg_dist_shard WHERE logicalrelid = 'copy_test'::regclass
);
TRUNCATE copy_test;
-- ==== try to COPY invalid data ====
-- here the coordinator actually sends the data, but then unexpectedly closes the
-- connection when it notices the data stream is broken. Crucially, it closes the
-- connection before sending COMMIT, so no data makes it into the worker.
COPY copy_test FROM PROGRAM 'echo 0, 0 && echo 1, 1 && echo 2, 4 && echo 3, 9 && echo 10' WITH CSV;
ERROR:  missing data for column "value"
CONTEXT:  COPY copy_test, line 5: "10"
-- kill the connection if the coordinator sends COMMIT. It doesn't, so nothing changes
SELECT citus.mitmproxy('flow.matches(b"COMMIT[^T]").kill()');
 mitmproxy 
-----------
 
(1 row)

COPY copy_test FROM PROGRAM 'echo 0, 0 && echo 1, 1 && echo 2, 4 && echo 3, 9 && echo 10' WITH CSV;
ERROR:  missing data for column "value"
CONTEXT:  COPY copy_test, line 5: "10"
SELECT * FROM copy_test;
 key | value 
-----+-------
(0 rows)

-- ==== clean up some more to prepare for tests with only one replica ====
SELECT citus.mitmproxy('flow.allow()');
 mitmproxy 
-----------
 
(1 row)

TRUNCATE copy_test;
UPDATE pg_dist_shard_placement SET shardstate = 3 WHERE nodeport = :worker_1_port;
SELECT * FROM pg_dist_shard_placement WHERE shardid IN (
  SELECT shardid FROM pg_dist_shard WHERE logicalrelid = 'copy_test'::regclass
);
 shardid | shardstate | shardlength | nodename  | nodeport | placementid 
---------+------------+-------------+-----------+----------+-------------
  100400 |          3 |           0 | localhost |    57637 |         100
  100400 |          1 |           0 | localhost |    57640 |         101
(2 rows)

-- ==== okay, run some tests where there's only one active shard ====
COPY copy_test FROM PROGRAM 'echo 0, 0 && echo 1, 1 && echo 2, 4 && echo 3, 9' WITH CSV;
SELECT * FROM copy_test;
 key | value 
-----+-------
   0 |     0
   1 |     1
   2 |     4
   3 |     9
(4 rows)

-- the worker is unreachable
SELECT citus.mitmproxy('flow.killall()');
 mitmproxy 
-----------
 
(1 row)

COPY copy_test FROM PROGRAM 'echo 0, 0 && echo 1, 1 && echo 2, 4 && echo 3, 9' WITH CSV;
WARNING:  connection not open
CONTEXT:  while executing command on localhost:57640
COPY copy_test, line 1: "0, 0"
ERROR:  failure on connection marked as essential: localhost:57640
CONTEXT:  COPY copy_test, line 1: "0, 0"
SELECT citus.mitmproxy('flow.allow()');
 mitmproxy 
-----------
 
(1 row)

SELECT * FROM copy_test;
 key | value 
-----+-------
   0 |     0
   1 |     1
   2 |     4
   3 |     9
(4 rows)

-- the first message fails
SELECT citus.mitmproxy('flow.contains(b"assign_distributed_transaction_id").killall()');
 mitmproxy 
-----------
 
(1 row)

COPY copy_test FROM PROGRAM 'echo 0, 0 && echo 1, 1 && echo 2, 4 && echo 3, 9' WITH CSV;
WARNING:  connection not open
CONTEXT:  while executing command on localhost:57640
COPY copy_test, line 1: "0, 0"
ERROR:  failure on connection marked as essential: localhost:57640
CONTEXT:  COPY copy_test, line 1: "0, 0"
SELECT citus.mitmproxy('flow.allow()');
 mitmproxy 
-----------
 
(1 row)

SELECT * FROM copy_test;
 key | value 
-----+-------
   0 |     0
   1 |     1
   2 |     4
   3 |     9
(4 rows)

-- the COPY message fails
SELECT citus.mitmproxy('flow.contains(b"FROM STDIN WITH").killall()');
 mitmproxy 
-----------
 
(1 row)

COPY copy_test FROM PROGRAM 'echo 0, 0 && echo 1, 1 && echo 2, 4 && echo 3, 9' WITH CSV;
ERROR:  server closed the connection unexpectedly
	This probably means the server terminated abnormally
	before or while processing the request.
CONTEXT:  while executing command on localhost:57640
COPY copy_test, line 1: "0, 0"
SELECT citus.mitmproxy('flow.allow()');
 mitmproxy 
-----------
 
(1 row)

SELECT * FROM copy_test;
 key | value 
-----+-------
   0 |     0
   1 |     1
   2 |     4
   3 |     9
(4 rows)

-- the COPY data fails
SELECT citus.mitmproxy('flow.contains(b"PGCOPY").killall()');
 mitmproxy 
-----------
 
(1 row)

COPY copy_test FROM PROGRAM 'echo 0, 0 && echo 1, 1 && echo 2, 4 && echo 3, 9' WITH CSV;
ERROR:  failed to COPY to shard 100400 on localhost:57640
SELECT citus.mitmproxy('flow.allow()');
 mitmproxy 
-----------
 
(1 row)

SELECT * FROM copy_test;
 key | value 
-----+-------
   0 |     0
   1 |     1
   2 |     4
   3 |     9
(4 rows)

-- the COMMIT fails
SELECT citus.mitmproxy('flow.matches(b"COMMIT[^T]").killall()');
 mitmproxy 
-----------
 
(1 row)

COPY copy_test FROM PROGRAM 'echo 0, 0 && echo 1, 1 && echo 2, 4 && echo 3, 9' WITH CSV;
WARNING:  connection not open
CONTEXT:  while executing command on localhost:57640
WARNING:  failed to commit critical transaction on localhost:57640, metadata is likely out of sync
WARNING:  connection not open
CONTEXT:  while executing command on localhost:57640
WARNING:  could not commit transaction for shard 100400 on any active node
ERROR:  could not commit transaction on any active node
SELECT citus.mitmproxy('flow.allow()');
 mitmproxy 
-----------
 
(1 row)

SELECT * FROM copy_test;
 key | value 
-----+-------
   0 |     0
   1 |     1
   2 |     4
   3 |     9
(4 rows)

-- the placement is not marked invalid
SELECT * FROM pg_dist_shard_placement WHERE shardid IN (
  SELECT shardid FROM pg_dist_shard WHERE logicalrelid = 'copy_test'::regclass
);
 shardid | shardstate | shardlength | nodename  | nodeport | placementid 
---------+------------+-------------+-----------+----------+-------------
  100400 |          3 |           0 | localhost |    57637 |         100
  100400 |          1 |           0 | localhost |    57640 |         101
(2 rows)

-- the COMMIT makes it through but the connection dies before we get a response
SELECT citus.mitmproxy('flow.matches(b"^C\x00\x00\x00\x0bCOMMIT").killall()');
 mitmproxy 
-----------
 
(1 row)

COPY copy_test FROM PROGRAM 'echo 0, 0 && echo 1, 1 && echo 2, 4 && echo 3, 9' WITH CSV;
WARNING:  connection not open
CONTEXT:  while executing command on localhost:57640
WARNING:  failed to commit critical transaction on localhost:57640, metadata is likely out of sync
WARNING:  connection not open
CONTEXT:  while executing command on localhost:57640
WARNING:  could not commit transaction for shard 100400 on any active node
ERROR:  could not commit transaction on any active node
SELECT citus.mitmproxy('flow.allow()');
 mitmproxy 
-----------
 
(1 row)

SELECT * FROM pg_dist_shard_placement WHERE shardid IN (
  SELECT shardid FROM pg_dist_shard WHERE logicalrelid = 'copy_test'::regclass
);
 shardid | shardstate | shardlength | nodename  | nodeport | placementid 
---------+------------+-------------+-----------+----------+-------------
  100400 |          3 |           0 | localhost |    57637 |         100
  100400 |          1 |           0 | localhost |    57640 |         101
(2 rows)

SELECT * FROM copy_test;
 key | value 
-----+-------
   0 |     0
   1 |     1
   2 |     4
   3 |     9
   0 |     0
   1 |     1
   2 |     4
   3 |     9
(8 rows)

-- ==== Clean up, we're done here ====
SELECT citus.mitmproxy('flow.allow()');
 mitmproxy 
-----------
 
(1 row)

DROP TABLE copy_test;
